{
  "schema": "arcade-experiment/v1",
  "id": "collision_probe_left",
  "start": "power_on",
  "events": [
    {"frame": 650, "port": ":mainpcb:IN0", "field": "Coin 1", "action": "press"},
    {"frame": 680, "port": ":mainpcb:IN0", "field": "Coin 1", "action": "release"},
    {"frame": 750, "port": ":mainpcb:a80000", "field": "1 Player Start", "action": "press"},
    {"frame": 780, "port": ":mainpcb:a80000", "field": "1 Player Start", "action": "release"},
    {"frame": 900, "port": ":mainpcb:8BADC.0", "field": "AD Stick X", "action": "set", "value": 0},
    {"frame": 900, "port": ":mainpcb:a80000", "field": "P1 Button 1", "action": "press"},
    {"frame": 1500, "port": ":mainpcb:8BADC.0", "field": "AD Stick X", "action": "set", "value": 128},
    {"frame": 1500, "port": ":mainpcb:a80000", "field": "P1 Button 1", "action": "release"}
  ],
  "expect": {"kind": "frame", "frame": 1800, "timeout_frames": 1920}
}
