{
  "schema": "arcade-experiment/v1",
  "id": "saved_state_left",
  "start": "saved_gameplay_frame_2400",
  "events": [
    {"frame": 2, "port": ":mainpcb:8BADC.0", "field": "AD Stick X", "action": "set", "value": 0},
    {"frame": 2, "port": ":mainpcb:a80000", "field": "P1 Button 1", "action": "release"},
    {"frame": 1800, "port": ":mainpcb:8BADC.0", "field": "AD Stick X", "action": "set", "value": 128}
  ],
  "expect": {"kind": "frame", "frame": 1800, "timeout_frames": 1920}
}
