{
  "schema": "arcade-experiment/v1",
  "id": "coin_start_sw_off_long",
  "start": "power_on",
  "events": [
    {"frame": 1, "port": ":mainpcb:SW1", "field": "SW1:1", "action": "set", "value": 1},
    {"frame": 1, "port": ":mainpcb:SW1", "field": "SW1:2", "action": "set", "value": 1},
    {"frame": 1, "port": ":mainpcb:SW1", "field": "SW1:3", "action": "set", "value": 1},
    {"frame": 1, "port": ":mainpcb:SW1", "field": "SW1:4", "action": "set", "value": 1},
    {"frame": 1, "port": ":mainpcb:SW1", "field": "SW1:5", "action": "set", "value": 1},
    {"frame": 1, "port": ":mainpcb:SW1", "field": "SW1:6", "action": "set", "value": 1},
    {"frame": 1, "port": ":mainpcb:SW1", "field": "SW1:7", "action": "set", "value": 1},
    {"frame": 1, "port": ":mainpcb:SW1", "field": "SW1:8", "action": "set", "value": 1},
    {"frame": 120, "port": ":mainpcb:IN0", "field": "Coin 1", "action": "press"},
    {"frame": 122, "port": ":mainpcb:IN0", "field": "Coin 1", "action": "release"},
    {"frame": 300, "port": ":mainpcb:a80000", "field": "1 Player Start", "action": "press"},
    {"frame": 302, "port": ":mainpcb:a80000", "field": "1 Player Start", "action": "release"}
  ],
  "expect": {"kind": "frame", "frame": 1800, "timeout_frames": 1920}
}
